title,description,holiday_from,holiday_till,holiday_type,is_active
adsadsad,dasd asd sad as das dasdsadas das d dasd asd sad as das dasdsadas das ddasd asd sad as das dasdsadas das ddasd asd sad as das dasdsadas das ddasd asd sad as das dasdsadas das ddasd asd sad as das dasdsadas das d,2021-05-12,2021-05-12,Unplanned,True
workers day,vgfd sg dsgf dfg sdfgsdgdsgdsg d sg vgfd sg dsgf dfg sdfgsdgdsgdsg d sgvgfd sg dsgf dfg sdfgsdgdsgdsg d sgvgfd sg dsgf dfg sdfgsdgdsgdsg d sgvgfd sg dsgf dfg sdfgsdgdsgdsg d sgvgfd sg dsgf dfg sdfgsdgdsgdsg d sgvgfd sg dsgf dfg sdfgsdgdsgdsg d sgvgfd sg dsgf dfg sdfgsdgdsgdsg d sgvgfd sg dsgf dfg sdfgsdgdsgdsg d sgvgfd sg dsgf dfg sdfgsdgdsgdsg d sgvgfd sg dsgf dfg sdfgsdgdsgdsg d sgvgfd sg dsgf dfg sdfgsdgdsgdsg d sg,2021-05-01,2021-05-01,Planned,True
asdad,asdsa dsa dsa das dsadsad ddsa asdsa dsa dsa das dsadsad ddsaasdsa dsa dsa das dsadsad ddsaasdsa dsa dsa das dsadsad ddsaasdsa dsa dsa das dsadsad ddsaasdsa dsa dsa das dsadsad ddsa,2021-04-30,2021-04-30,Unplanned,True
jkhf saj,ADA DSA DA sfdsfds ADA DSA DA sfdsfdsADA DSA DA sfdsfdsADA DSA DA sfdsfdsADA DSA DA sfdsfds,2021-07-30,2021-07-30,Planned,True
sfdf sfd fsdf ds,fsd dsfff sddddddddddddddddddd fdsfsdfsds ffsdfsfs fsffsfsd fsfsdfsfs fs fsd dsfff sddddddddddddddddddd fdsfsdfsds ffsdfsfs fsffsfsd fsfsdfsfs fs fsd dsfff sddddddddddddddddddd fdsfsdfsds ffsdfsfs fsffsfsd fsfsdfsfs fsfsd dsfff sddddddddddddddddddd fdsfsdfsds ffsdfsfs fsffsfsd fsfsdfsfs fsfsd dsfff sddddddddddddddddddd fdsfsdfsds ffsdfsfs fsffsfsd fsfsdfsfs fs,2021-06-29,2021-06-30,No Working Day,True
cdscsd,cfd sfds fsd fsd fsdfsd,2021-07-08,2021-07-08,Planned,True
cdscsd,scdscsdd cds ds ssd,2021-07-01,2021-07-01,No Working Day,True
dsadad,adsdasdas,2021-06-30,2021-06-30,Unplanned,True
asdada,Laudantium reprehen,2021-06-18,2021-06-18,Planned,True
ads,Cillum assumenda sed,2021-06-08,2021-06-08,No Working Day,True
